{
  "version": "2.0",
  "generated_at": "2026-04-14T07:41:00Z",
  "generator": "Scripts/tools/generate-context-index.py",
  "entry_count": 29,
  "domains": {
    "compatibility": {
      "count": 0,
      "layers": []
    },
    "integration": {
      "count": 2,
      "layers": [
        "experience"
      ]
    },
    "release": {
      "count": 6,
      "layers": [
        "experience",
        "tech"
      ]
    },
    "testing": {
      "count": 3,
      "layers": [
        "tech"
      ]
    },
    "architecture": {
      "count": 0,
      "layers": []
    },
    "ci": {
      "count": 4,
      "layers": [
        "experience"
      ]
    },
    "sources": {
      "count": 14,
      "layers": [
        "experience",
        "tech"
      ]
    }
  },
  "entries": [
    {
      "id": "ctx-ci-001",
      "path": ".context/ci/experience/ctx-ci-001-artifact-structure-loss.md",
      "title": "GitHub Actions Artifact 上传导致 XCFramework 结构丢失",
      "domain": "ci",
      "layer": "experience",
      "tags": [
        "github-actions",
        "artifact-upload",
        "xcframework",
        "info-plist",
        "directory-structure"
      ],
      "triggers": [
        "Info.plist not found after artifact download",
        "XCFramework structure lost in GitHub Actions",
        "upload-artifact v4 directory structure",
        "multiple xcframeworks artifact upload"
      ],
      "summary": "GitHub Actions upload-artifact v4 flattens XCFramework dirs; use staging directory to preserve structure",
      "status": "active",
      "updated": "2026-02-22"
    },
    {
      "id": "ctx-ci-002",
      "path": ".context/ci/experience/ctx-ci-002-matrix-artifact-conflict.md",
      "title": "GitHub Actions Matrix 构建中 Artifact 名称冲突",
      "domain": "ci",
      "layer": "experience",
      "tags": [
        "github-actions",
        "matrix-build",
        "artifact-conflict",
        "upload-artifact-v4"
      ],
      "triggers": [
        "matrix build artifact overwrite conflict",
        "only last matrix job artifact preserved",
        "upload-artifact v4 same name conflict",
        "GitHub Actions matrix artifact naming"
      ],
      "summary": "GitHub Actions v4 matrix builds overwrite same-name artifacts; use unique names with matrix variable",
      "status": "active",
      "updated": "2026-02-22"
    },
    {
      "id": "ctx-ci-003",
      "path": ".context/ci/experience/ctx-ci-003-duplicate-build-abi-conflict.md",
      "title": "模块重复构建导致 Swift 编译器 ABI 冲突崩溃",
      "domain": "ci",
      "layer": "experience",
      "tags": [
        "swift-compiler-crash",
        "abi-conflict",
        "duplicate-build",
        "cocoapods",
        "xcframework",
        "sil-deserialization"
      ],
      "triggers": [
        "Swift compiler crash deserializing SIL function",
        "duplicate module build ABI conflict",
        "module in both pod schemes and build stages",
        "compiler crash PerformanceSILLinker"
      ],
      "summary": "Module built in both pod prebuild and xcframework stages causes Swift compiler ABI conflict crash",
      "status": "active",
      "updated": "2026-02-22"
    },
    {
      "id": "ctx-ci-004",
      "path": ".context/ci/experience/ctx-ci-004-preinstall-source-dependency.md",
      "title": "Podfile pre_install hook 中构建脚本依赖未就绪的源码目录",
      "domain": "ci",
      "layer": "experience",
      "tags": [
        "cocoapods",
        "pre-install-hook",
        "xcodegen",
        "chicken-egg",
        "gitignore",
        "prepare-command"
      ],
      "triggers": [
        "XcodeGen missing source directory in CI",
        "pre_install hook depends on prepare_command directory",
        "pod install fails in CI but works locally",
        "chicken-egg source directory dependency"
      ],
      "summary": "pre_install hook fails in CI because gitignored source dir is created by prepare_command after hook runs",
      "status": "active",
      "updated": "2026-02-22"
    },
    {
      "id": "ctx-integration-001",
      "path": ".context/integration/experience/ctx-integration-001-novacore-duplicate-symbols.md",
      "title": "NovaCore.xcframework 静态链接第三方库导致使用方 duplicate symbol crash",
      "domain": "integration",
      "layer": "experience",
      "tags": [
        "duplicate-symbol",
        "xcframework",
        "static-linking",
        "novacore",
        "unexported-symbols",
        "snapkit",
        "kingfisher",
        "omsdk",
        "prebidmobile"
      ],
      "triggers": [
        "NovaCore duplicate symbol crash with SnapKit or Kingfisher",
        "xcframework static link third-party library conflict",
        "UNEXPORTED_SYMBOLS_FILE usage for symbol hiding",
        "host app duplicate symbol linker error",
        "OMSDK duplicate class warning",
        "PrebidMobile OMID class conflict"
      ],
      "summary": "NovaCore static links SnapKit/Kingfisher and triggers duplicate symbols; fix with symbol hiding and dynamic OMSDK.",
      "status": "active",
      "updated": "2026-03-03"
    },
    {
      "id": "ctx-integration-002",
      "path": ".context/integration/experience/ctx-integration-002-facebook-adapter-flat-namespace-crash.md",
      "title": "MSPFacebookAdapter mh_dylib + dynamic_lookup 导致 Release strip 后 flat namespace crash",
      "domain": "integration",
      "layer": "experience",
      "tags": [
        "facebook-adapter",
        "dynamic-lookup",
        "flat-namespace",
        "staticlib",
        "mh-dylib",
        "linker-crash"
      ],
      "triggers": [
        "flat namespace crash after Release strip",
        "dynamic_lookup causes runtime crash",
        "mh_dylib vs staticlib adapter choice",
        "FBAudienceNetwork adapter linking strategy"
      ],
      "summary": "mh_dylib + dynamic_lookup causes flat namespace crash after strip; switch to staticlib + headers-only shim",
      "status": "active",
      "updated": "2026-02-22"
    },
    {
      "id": "ctx-release-001",
      "path": ".context/release/experience/ctx-release-001.md",
      "title": "Pod 发布后使用方启动 crash - FB SDK 静态链接冲突",
      "domain": "release",
      "layer": "experience",
      "tags": [
        "facebook",
        "static-linking",
        "xcframework",
        "crash",
        "symbol-conflict",
        "shim-framework"
      ],
      "triggers": [
        "FB SDK crash after pod release",
        "FBFinalClassViolationException on app launch",
        "duplicate symbol FBAudienceNetwork",
        "shim framework for static linking"
      ],
      "summary": "FBAudienceNetwork static linking in XCFramework causes duplicate symbol crash; solved with shim framework",
      "status": "active",
      "updated": "2026-02-22"
    },
    {
      "id": "ctx-release-002",
      "path": ".context/release/experience/ctx-release-002.md",
      "title": "Pod trunk push 失败但脚本显示成功 - 退出码捕获错误",
      "domain": "release",
      "layer": "experience",
      "tags": [
        "pod-trunk-push",
        "shell-pipeline",
        "exit-code",
        "pipestatus",
        "tee"
      ],
      "triggers": [
        "pod trunk push succeeds but version not published",
        "shell pipeline exit code incorrect",
        "PIPESTATUS tee exit code",
        "CI shows success but pod not released"
      ],
      "summary": "Shell pipeline with tee masks pod trunk push failure; use PIPESTATUS[0] to capture real exit code",
      "status": "active",
      "updated": "2026-02-22"
    },
    {
      "id": "ctx-release-003",
      "path": ".context/release/experience/ctx-release-003.md",
      "title": "Pod 发布后使用方 crash - Kingfisher 静态链接重复",
      "domain": "release",
      "layer": "experience",
      "tags": [
        "kingfisher",
        "static-linking",
        "xcframework",
        "duplicate-symbol",
        "novacore",
        "wrapper-api"
      ],
      "triggers": [
        "Kingfisher objc_retain crash after pod release",
        "NovaCore duplicate Kingfisher symbols",
        "static linked third-party library crash in xcframework",
        "wrapper API to avoid duplicate symbol"
      ],
      "summary": "Kingfisher statically linked in NovaCore causes duplicate symbol crash; solved with wrapper API pattern",
      "status": "active",
      "updated": "2026-02-22"
    },
    {
      "id": "ctx-release-004",
      "path": ".context/release/experience/ctx-release-004-xcframework-version-stale.md",
      "title": "XCFramework 二进制中版本号未更新 — 构建时序问题",
      "domain": "release",
      "layer": "experience",
      "tags": [
        "xcframework",
        "version",
        "build-order",
        "config-plist",
        "novacore",
        "novaconstants",
        "getsdkversion",
        "marketing-version"
      ],
      "triggers": [
        "XCFramework version stale after release",
        "Config.plist SDKVersion wrong in binary",
        "NovaConstants.version 0.0.0",
        "getSDKVersion returns old version",
        "version not updated in xcframework binary",
        "build order version mismatch"
      ],
      "summary": "XCFramework built before version update leaves stale binary versions; NovaConstants update also missed commit.",
      "status": "active",
      "updated": "2026-02-27"
    },
    {
      "id": "ctx-release-005",
      "path": ".context/release/tech/ctx-release-005-version-ssot-flow.md",
      "title": "SDK 版本 SSOT 及更新流程",
      "domain": "release",
      "layer": "tech",
      "tags": [
        "version",
        "ssot",
        "sdk-version",
        "config-plist",
        "marketing-version",
        "testflight",
        "sdk-version-conf",
        "version-flow"
      ],
      "triggers": [
        "SDK version SSOT flow",
        "sdk_version.conf update process",
        "MARKETING_VERSION source",
        "version commit order",
        "Config.plist version update flow",
        "TestFlight SDK version",
        "release version flow",
        "version SSOT",
        "version 流转",
        "版本更新流程"
      ],